{
  "id": "reef-biomass-result",
  "type": "Feature",
  "stac_version": "1.0.0",
  "collection": "seadots-outputs",
  "geometry": {
    "type": "Polygon",
    "coordinates": [
      [
        [
          4.7,
          59.1
        ],
        [
          5.0,
          59.1
        ],
        [
          5.0,
          59.4
        ],
        [
          4.7,
          59.4
        ],
        [
          4.7,
          59.1
        ]
      ]
    ]
  },
  "bbox": [
    4.7,
    59.1,
    5.0,
    59.4
  ],
  "properties": {
    "title": "Reef biomass result",
    "description": "Example output product generated by a SeaDOTs execution.",
    "datetime": "2026-05-26T09:03:00Z",
    "role": "output",
    "convention": "CF-1.10",
    "cf:parameter": [
      {
        "name": "biomass",
        "schema": "http://vocab.nerc.ac.uk/standard_name/",
        "unit": "kg",
        "description": "Optional CF-style parameter declaration for the output quantity."
      }
    ],
    "derivedFrom": [
      "https://w3id.org/ogc/hosted/seadots/catalog/input/aoi-utsira"
    ]
  },
  "assets": {
    "data": {
      "href": "https://example.org/seadots/outputs/reef-biomass-result.json",
      "type": "application/json",
      "title": "Reef biomass JSON result"
    }
  },
  "links": [
    {
      "rel": "describedby",
      "href": "bblocks://ogc.hosted.seadots.catalog-output",
      "type": "application/schema+json"
    },
    {
      "rel": "derived_from",
      "href": "https://w3id.org/ogc/hosted/seadots/catalog/input/aoi-utsira"
    },
    {
      "rel": "via",
      "href": "https://w3id.org/ogc/hosted/seadots/catalog/execution/reef-effect-run-001"
    }
  ]
}